PT	AU	BE	TI	X1	Y1	Z1	SO	LA	DT	DE	X5	Y5	Z5	AB	X4	Y4	Z4	C1	EM	RI	OI	CR	NR	TC	Z9	U1	U2	PU	PI	PA	SN	PD	PY	VL	IS	BP	EP	DI	EC	C2	SC	UT	OA	HC	HP	DA
J	Gonçalves, Irlen Antônio; Versieux, Daniela Pereira		Escrevendo por sobre a terra: as fazendas-modelo em Minas Gerais (1906-1915)	Escrevendo por sobre a terra: las haciendas modelo en Minas Gerais (1906-1915)	Writing upon the land: model farms in Minas Gerais (1906-1915)	Écrivant a propos de la terre: les fermes modeles dans l'état de Minas Gerais (1906-1915)	História da Educação	Portuguese	research-article	model farms; agricultural education; demonstration fields	haciendas modelo; la enseñanza agrícola; campos de demostración	fazendas-modelo; ensino agrícola; campos de demonstração	fermes-modèles; l'enseignement agricole; des champs de démonstration	Model farms, institutions for practical agricultural education, were spread all over Brazil and, in Minas Gerais, in the capital and other country towns. They were instituted as part as a national public policy in the first years of the 20th century. In Minas Gerais, were created between the years 1906 and 1915. In this text we propose to understand how the model farms came to be education institutions, in the aspects of her materiality and the subject of learning and knowledge. Then, there will be a dialogue and a questioning of the historical sources of many roots, such as legislation, the proceedings of the Congress Legislature, annual reports and records of the Board of Agriculture and the annual reports of the Secretary of Agriculture.	Las haciendas modelo, instituciones de enseñanza agrícola práctica, se han implantado en todo el Brasil y en Minas Gerais, en la capital, y en algunos pueblos. Fueron instituidas como parte de una política pública nacional en los primeros años del siglo 20. En Minas Gerais fueron creadas entre los años 1906 y 1915. En este trabajo nos proponemos entender cómo las haciendas modelo surgieron como instituciones educativas, en los aspectos de su materialidad y de los sujetos de aprendizaje y conocimiento. Por lo tanto, habrá un diálogo y un cuestionamiento de las fuentes históricas de diversos orígenes, tales como: la legislación, los procedimientos del Congreso Legislativo, los informes anuales y los registros de la Junta de Agricultura y los informes anuales de la Secretaría de Agricultura.	As fazendas-modelo, instituições de ensino agrícola de caráter prático, foram implantadas pelo Brasil e, em Minas Gerais, na capital e em algumas cidades do interior. Elas foram instituídas como parte de uma política pública nacional nos anos iniciais do século 20. Em Minas Gerais foram criadas entre os anos de 1906 e 1915. Neste texto nos propomos compreender como as fazendas-modelo surgiram como instituições de ensino, sua materialidade e os sujeitos da aprendizagem e conhecimentos. Assim, será realizado um diálogo e uma problematização das fontes históricas de diversas origens, tais como a legislação, os anais do Congresso Legislativo, os relatórios anuais e expedientes da diretoria de Agricultura e os relatórios anuais da Secretaria da Agricultura.	Résumé Les fermes modèles, des établissements d'enseignement pratique de l'agriculture, ont été mises en place au Brésil et à Minas Gerais, dans la capitale et dans certaines villes rurales. Ces fermes ont éte instituées dans le cadre d'un programme national de politiques publiques au début du 20e siècle. À l'État de Minas Gerais elles ont éte créées entre les années 1906 et 1915. Dans ce texte nous nous proposons de comprendre comment les fermes modèles sont apparues, comme des établissements d'enseignement, en tenant compte de sa matérialité et en considérant les sujets de l'apprentissage et de la connaissance. Ainsi, un dialogue aura lieu et aussi une remise en cause des sources historiques d'origines diverses telles que : la législation, les annales du Congrès Législatif, les rappots annuels, les registres de la direction de l'Agriculture et les rapports annuels du Sécretariat de l'Agriculture	[Versieux, Daniela Pereira] Instituto Federal de Educação, Ciência e Tecnologia de Goiás, Brazil; [Gonçalves, Irlen Antônio] Centro Federal de Educação Tecnológica de Minas Gerais, Brasil					16	0	0	0	0	Associação Sul-Rio-Grandense de Pesquisadores em História da Educação			2236-3459	08	2015	19	46	201	222	10.1590/2236-3459/25589	Education & Educational Research	SciELO Brazil	Education & Educational Research	SCIELO:S2236-34592015000200201	gold				
J	Squinca, Flávia; Guilhem, Dirce; Squinca, Juliana Paula		ANALYSIS OF MANUSCRIPTS ON ETHICS IN SCIENTIFIC RESEARCH AT SCIENTIFIC ELECTRONIC LIBRARY ONLINE (SCIELO)	ANÁLISE DAS PUBLICAÇÕES SOBRE A ÉTICA NA INVESTIGAÇÃO CIENTÍFICA EM SCIENTIFIC ELECTRONIC LIBRARY ONLINE (SCIELO)	ANÁLISIS DE LAS PUBLICACIONES SOBRE LA ÉTICA EN LA INVESTIGACIÓN CIENTÍFICA EN SCIENTIFIC ELECTRONIC LIBRARY ONLINE (SCIELO)		Revista Latinoamericana de Bioética	English	research-article	Ethics; Research; Scientific and Technical Publications; Journal Article	Ética en investigación; publicaciones científicas y técnicas; artículo de revista	Ética em investigação; publicações científicas e técnicas; artigo de revista		Ethics in research became a central theme regarding globalization of the scientific development, particularly when related to the socioeconomic conditions of the countries involved as partners in research protocols, production of inputs and of knowledge. The objective of this paper is to analyze the sources of information about ethics in research present at Scientific Electronic Library Online (SciELO). Methodologically, this is an exploratory study was carried out by the systematic analysis of the literature available. The search engines retrieved 885 summaries, from which 170 were analyzed. The first publication was dated from 1996 and it could be identified the mention to international documents about research in humans. Since 2002 there has been an increase of publications related to the gain of legitimacy of the topic in academy. As a conclusion, although the amount is not huge, the manuscripts presented great impact as they stimulated debates and produced scientific knowledge on the topic. It can be observed that ethics in research has outcome the biomedical field, being inserted in other fields of knowledge.	La ética en la investigación se convirtió en un tema central en relación con la globalización del desarrollo científico, sobre todo cuando se refieren a las condiciones socioeconómicas de los países que participan como socios en los protocolos de investigación, la producción de los insumos y del conocimiento. El objetivo de este trabajo es analizar las fuentes de información acerca de la ética en la investigación actual en Scientific Electronic Library Online (SciELO). Metodológicamente, se trata de un estudio exploratorio que se llevó a cabo mediante el análisis sistemático de la literatura disponible. Los motores de búsqueda recuperaron 885 resúmenes, de los cuales se analizaron 170. La primera publicación fue fechada en 1996 y se pudo identificar la mención a los documentos internacionales sobre la investigación en seres humanos. Desde 2002 ha habido un aumento de las publicaciones relacionadas con la ganancia de la legitimidad del tema en la academia. Como conclusión, aunque la cantidad no es muy grande, los manuscritos presen gran impacto, ya que estimulan debates y producen el conocimiento científico sobre el tema. Se puede observar que la ética en la investigación ha resultado del campo de la biomedicina, que se inserta en otros campos del conocimiento.	A ética em investigação tornou-se um tema central em relação com a globalização do desenvolvimento científico, em especial quando se refere às condições socioeconômicas dos países que participam como sócios na implementação de pesquisa, na produção dos insumos e do conhecimento. O objetivo do presente estudo é analisar as fontes de informação sobre a ética na pesquisa atual em Scientific Electronic Library Online (SciELO). Metodologicamente, trata-se de um estudo exploratório, que levou-se por meio da análise sistemática da literatura disponível. Os motores de busca recuperaram 885 resumos, dos quais foram analisados 170. A primeira publicação foi datada em 1996 e foi capaz de identificar a referência aos documentos internacionais sobre a pesquisa em seres humanos. Desde 2002 tem havido um aumento das publicações relacionadas com o ganho da legitimidade do tema na academia. Em conclusão, embora a quantidade não é muito grande, os manuscritos presen grande impacto, pois estimulam debates e produzem o conhecimento científico sobre o assunto. Pode-se ver que a ética na investigação tem sido o resultado do campo da biomedicina, que é inserido em outros campos do conhecimento.		[Squinca, Flávia; Guilhem, Dirce] Hospital Universitário de Brasília (HUB), Brasil; [Squinca, Juliana Paula] Instituto Federal de Goiás, Brasil					13	0	0	0	0	Universidad Militar Nueva Granada			2462-859X	07	2015	15	2	156	161		Medical Ethics	SciELO Colombia	Medical Ethics	SCIELO:S1657-47022015000200013	gold				
J	Pereira, Lidiane de Lemos Soares; Benite, Claudio Roberto Machado; Padilha, Juliana Caixeta; Mendes, Maria Luiza; Vilela-Ribeiro, Eveline Borges; Benite, Anna Maria Canavarro		Trajetória da formação de professores de ciências para educação inclusiva em Goiás, Brasil, sob a ótica de participantes de uma rede colaborativa	Trajectory of the training of science teachers for inclusive education in Goiás, Brazil, from the perspective of participants in a collaborative network			Ciência & Educação (Bauru)	Portuguese	research-article	Science Teachers Training; Science teaching; Inclusive education		Formação de professores; Ensino de ciências; Educação inclusiva		We present an investigation using participatory research that aims to present the scenario of the training of science teachers in education using inclusive discursive in meetings of a research network in the state of Goiás Our results allowed us to rethink the policy of inclusive education the state of Goiás, and reflect on how science education can contribute to the formation of a citizen in this inclusive school.		Apresenta-se uma investigação com elementos de uma pesquisa participante que objetivou apresentar o cenário da formação de professores de ciências no âmbito da educação inclusiva utilizando interações discursivas produzidas em reuniões de uma rede de pesquisa no estado de Goiás. Os resultados permitiram analisar a política de educação inclusiva no estado de Goiás, bem como refletir sobre como o ensino de ciências pode contribuir para a formação de cidadãos dentro dessa escola inclusiva.		[Pereira, Lidiane de Lemos Soares] Instituto Federal de Educação, Ciência e Tecnologia de Goiás, Brazil; [Benite, Claudio Roberto Machado; Vilela-Ribeiro, Eveline Borges; Benite, Anna Maria Canavarro] Universidade Federal de Goiás, Brazil; [Padilha, Juliana Caixeta; Mendes, Maria Luiza] Secretaria de Estado de Educação, Cultura e Esporte, Brazil					35	2	3	0	7	Programa de Pós-Graduação em Educação para a Ciência, Universidade Estadual Paulista (UNESP), Faculdade de Ciências, campus de Bauru.	Bauru	Bauru	1980-850X	06	2015	21	2	473	491	10.1590/1516-731320150020013	Education & Educational Research	SciELO Brazil	Education & Educational Research	SCIELO:S1516-73132015000200013	gold				
J	Mazivila, Sarmento J.; Mitsutake, Hery; Santana, Felipe B. de; Gontijo, Lucas C.; Santos, Douglas Q.; Borges Neto, Waldomiro		Fast Classification of Different Oils and Routes Used in Biodiesel Production Using Mid Infrared Spectroscopy and PLS2-DA				Journal of the Brazilian Chemical Society	English	research-article	biodiesel; infrared; PLS2-DA classification				This work aimed at employing partial least square discriminant analysis (PLS2-DA), allied to mid-infrared (MIR) spectroscopy as an analytical method for simultaneous classification of biodiesels from different oils (soybean and used frying oil) and routes (methylic and ethylic). The evaluation of the model was verified through values of sensitivity and specificity for each parameter, in the interest class. PLS2-DA model showed 100% correct classification in the discrimination of types of biodiesels. Therefore, the proposed methodology is fast, because it allows simultaneous classification of different types of biodiesels. Consequently, it can be used in quality control of this type of biofuel.				[Santos, Douglas Q.] Universidade Federal de Uberlândia, Brazil; [Mazivila, Sarmento J.; Mitsutake, Hery; Santana, Felipe B. de; Gontijo, Lucas C.; Borges Neto, Waldomiro] Universidade Federal de Uberlândia, Brazil; [Mazivila, Sarmento J.] Escola secundária josina machel de belane, Mozambique; [Gontijo, Lucas C.] Instituto Federal de Educação, Ciência e Tecnologia de Goiás, Brazil		Santana, Felipe/O-7566-2019; Santana, Felipe Bachion/D-6431-2018; Neto, Waldomiro Borges/I-6147-2016; Mitsutake, Hery/J-3928-2014; Santos, Douglas/L-6264-2016; Mazivila, Sarmento J./ABC-1863-2020	Santana, Felipe/0000-0001-8580-0100; Santana, Felipe Bachion/0000-0001-8580-0100; Neto, Waldomiro Borges/0000-0002-5808-5073; Mitsutake, Hery/0000-0002-8769-0301; Santos, Douglas/0000-0002-3258-8932; Mazivila, Sarmento J./0000-0001-5644-723X		37	1	10	0	9	Sociedade Brasileira de Química	São Paulo	São Paulo	1678-4790	04	2015	26	4	642	648	10.5935/0103-5053.20150020	Chemistry, Multidisciplinary	SciELO Brazil	Chemistry	SCIELO:S0103-50532015000400642	gold				
J	Melo, Arthur Tavares de Oliveira; Coelho, Alexandre Siqueira Guedes; Pereira, Marlei Ferreira; Blanco, Angel José Vieira; Franceschinelli, Edivani Villaron		GENÉTICA DA CONSERVAÇÃO DE Cabralea canjerana (Vell.) Mart. (Meliaceae) EM FRAGMENTOS FLORESTAIS DE MATA ATLÂNTICA NA APA FERNÃO DIAS	CONSERVATION GENETICS OF Cabralea canjerana (Vell.) Mart. (Meliaceae) IN ATLANTIC FOREST FRAGMENTS OF FERNÃO DIAS EPA			Revista Árvore	Portuguese	research-article	Brazilian Atlantic Forest; Genetic diversity; Biological conservation		Mata Atlântica; Diversidade genética; Conservação biológica		The Atlantic Forest is the biome that is most severely affected by environmental fragmentation. The analysis of genetic diversity structure and demographic and quantitative characteristics allow us to estimate important population parameters to use in conservation programs of endangered species. Cabralea canjerana ssp. canjerana (Meliaceae) is a dioecious tree species that can be considered as a model for Atlantic Forest conservation studies. One hundred and eighty three individuals of eight C. canjeranasubpopulations were randomly sampled in forests fragments of the Environmental Protection Area (EPA) Fernão Dias, in Southern Minas Gerais State, Brazil. Using microsatellite markers, the genetic diversity was estimated and contrasted with quantitative and geographic traits of these eight subpopulations. High levels of genetic diversity were found. A small, but significant, portion of the total genetic variance is structured among the subpopulations (θ = 0.053), structured in two different groups. The estimates of the levels of genetic diversity were higher in populations above 1,800 meters of altitude, corroborating with the importance of these populations in the maintenance of genetic diversity. The population density observed was also higher in high altitude fragments (r = 0.849; p-value = 0.007). There was no significative correlation between phenotypic variables (height of individuals and stem diameter) and genetic diversity measures. Conservationist efforts that improve gene flow between these forest fragments must be stimulated, mainly between fragments of higher altitude and fragments of lower altitude. It is shown that populations located at high altitudes have a greater number of individuals per hectare and, therefore, higher levels of genetic diversity. These areas may be treated as repository of genetic diversity and its maintenance is extremely important. The Brazilian Forest Code determines that these areas above 1,800 meters altitude are considered as Permanent Protection Areas (PPA).		A Mata Atlântica é o bioma brasileiro mais severamente afetado pela fragmentação ambiental. A análise da estruturação da diversidade genética, assim como de características demográficas e quantitativas, permite inferir parâmetros populacionais importantes para os programas de conservação de espécies ameaçadas. Cabralea canjerana ssp. canjerana (Meliaceae) é uma espécie arbórea dioica considerada modelo para estudos de conservação da Mata Atlântica. Cento e oitenta e três indivíduos de oito subpopulações de C. canjerana foram coletados em fragmentos florestais na Área de Proteção Ambiental (APA) Fernão Dias, no Sul do Estado de Minas Gerais, Brasil. Utilizando marcadores microssatélites, a diversidade genética foi estimada e contrastada com medidas quantitativas e medidas geográficas dessas oito subpopulações. Elevados níveis de diversidade genética foram encontrados. Uma porção pequena, porém significativa, da variância genética total está estruturada entre as populações (θ = 0,053), que foram estruturadas em dois grupos distintos. As estimativas dos níveis de diversidade genética nas populações localizadas acima de 1.800 m de altitude foram maiores, corroborando a importância dessas populações na manutenção da diversidade genética. A densidade populacional observada também foi maior nos fragmentos de maior altitude (r = 0,849; p-valor = 0,007). Não houve correlação significativa entre as variáveis fenotípicas (altura dos indivíduos e diâmetro a 1,50 m acima do solo) e as medidas de diversidade genética. Esforços conservacionistas para que aumentem o fluxo gênico entre esses fragmentos florestais devem ser estimulados, principalmente entre os fragmentos de baixa altitude e os fragmentos de elevada altitude. É comprovado que populações situadas em elevadas altitudes possuem maior número de indivíduos por hectare e, portanto, maiores índices de diversidade genética. Essas áreas podem ser tratadas como repositório de diversidade genética, e sua manutenção é de extrema importância. O Código Florestal brasileiro determina que essas áreas acima de 1.800 m de altitudes sejam consideradas Áreas de Proteção Permanente (APP).		[Franceschinelli, Edivani Villaron] Universidade Federal de Goiás, Brazil; [Melo, Arthur Tavares de Oliveira] Universidade Federal de Goiás, Brazil; [Coelho, Alexandre Siqueira Guedes] Universidade Federal de Goiás, Brazil; [Pereira, Marlei Ferreira; Blanco, Angel José Vieira] Instituto Federal de Educação, Ciência e Tecnologia de Goiás, Brazil		Franceschinelli, Edivani V/G-6401-2012; Melo, Arthur/J-2187-2018; Coelho, Alexandre S. G./G-1563-2012; Franceschinelli, Edivani/W-1035-2019	Franceschinelli, Edivani V/0000-0001-9050-8577; Franceschinelli, Edivani/0000-0001-9050-8577; Coelho, Alexandre/0000-0002-2518-7575		35	2	3	1	18	Sociedade de Investigações Florestais	Viçosa	Viçosa	1806-9088	04	2015	39	2	365	374	10.1590/0100-67622015000200016	Forestry	SciELO Brazil	Forestry	SCIELO:S0100-67622015000200365	gold				
J	Siqueira, Ana Paula Silva; Pacheco, Maria Teresa Bertoldo; Naves, Maria Margareth Veloso		Nutritional quality and bioactive compounds of partially defatted baru almond flour				Food Science and Technology (Campinas)	English	research-article	baru seed; protein; chemical composition; amino acids; antioxidants				This study aimed to investigate the nutritional quality and bioactive potential of partially defatted baru (Dipteryx alataVog.) almond flour (BAF). The flour’s proximate and mineral compositions, total phenolic, tocopherols and carotenoids contents, antioxidant capacity, trypsin inhibitor and amino acid analyses were performed. An experiment was conducted with 24 male Wistar rats in order to evaluate the flour’s protein quality. BAF has high protein, fiber and mineral contents (iron, zinc, magnesium and copper), and it is a source of calcium. BAF presented relevant amounts of total phenolics (625 mg/100g) and good antioxidant capacity (130 µmol/Trolox eq). Autoclaved BAF showed essential amino acids profile, digestibility and protein quality better than in natura BAF. Autoclaved BAF might be used for human consumption as a source of quality protein and bioactive compounds, in healthy diets and processed foods.				Instituto Federal de Educação, Ciência e Tecnologia de Goiás, Brazil; Food Technology Institute, Brazil; [Naves, Maria Margareth Veloso] Universidade Federal de Goiás, Brazil		Pacheco, Maria Teresa Bertoldo/E-5339-2012; Naves, Maria Margareth V./I-4828-2015	Pacheco, Maria Teresa Bertoldo/0000-0003-4776-1571; Naves, Maria Margareth V./0000-0003-4332-6206		34	5	13	1	33	Sociedade Brasileira de Ciência e Tecnologia de Alimentos	Campinas	Campinas	1678-457X	03	2015	35	1	127	132	10.1590/1678-457X.6532	Food Science & Technology	SciELO Brazil	Food Science & Technology	SCIELO:S0101-20612015000100127	gold				
J	Sousa, Ricardo Fernandes de; Brasil, Eliana Paula Fernandes; Figueiredo, Cícero Célio de; Leandro, Wilson Mozena		SOIL ORGANIC MATTER FRACTIONS IN PRESERVED AND DISTURBED WETLANDS OF THE CERRADO BIOME	FRAÇÕES DA MATÉRIA ORGÂNICA DO SOLO EM VEREDAS CONSERVADAS E ANTROPIZADAS NO BIOMA CERRADO			Revista Brasileira de Ciência do Solo	English	research-article	hydromorphic soils; land use; particulate fraction; humic substances; organic carbon		solos hidromórficos; uso da terra; fração particulada; substâncias húmicas; carbono orgânico		Veredas are humid tropical ecosystems, generally associated to hydromorphic soils and a shallow water table. The soils of these ecosystems are affected by the use of the areas around these veredas. The objective of this study was to determine soil organic matter (SOM) fractions in veredas adjacent to preserved (native savanna) and disturbed environments (agricultural areas and pastures) in the Cerrado biome. Soil samples were collected from the 0-10 and 10-20 cm layers along reference lines drawn along the relief following the upper, middle and lower positions of one of the slopes, in the direction of the draining line of the vereda. The soil analysis determined: total soil OC, total nitrogen and C:N ratio; C and N contents and C:N ratio in particulate and mineral-associated fractions (of SOM); fulvic acids, humic acids and humin fractions and ratio between humic and fulvic acids. The agricultural use around the veredas induced changes in the SOM fractions, more pronounced in the lower part of the slope. In the soil surface of this part, the OC levels in the humic substances and the particulate fraction of SOM, as well as total soil OC were reduced in the vereda next to crop fields.		As veredas são ecossistemas tropicais úmidos, geralmente associados a solos hidromórficos e afloramento do lençol freático. Os solos desses ecossistemas sofrem alterações conforme o uso das áreas do entorno dessas veredas. Este trabalho teve como objetivo determinar as frações da matéria orgânica do solo (MOS) em áreas úmidas (veredas) adjacentes a ambientes conservados e antropizados (em áreas agrícolas e pastagens), no bioma Cerrado. Amostras de solo foram coletadas nas profundidades de 0-10 e 10-20 cm, ao longo de linhas de referência dispostas, segundo sua posição no relevo, nas posições superior, média e inferior de uma das vertentes, acompanhando o sentido da linha de drenagem da vereda. Foram determinados o C orgânico total e N total do solo, bem como a relação C:N, teores de C, N e relações C:N das frações particulada e associada a minerais (da MOS), além do C das frações ácidos fúlvicos, ácidos húmicos e humina e relação entre ácidos húmicos e fúlvicos. O uso agropecuário da terra no entorno das veredas promoveu diminuição dos teores de C das frações da MOS, de forma mais pronunciada na porção inferior da vertente. Nessa porção, em superfície, os níveis de C orgânico contidos nas substâncias húmicas e na fração particulada da MOS, do mesmo modo que o C orgânico total do solo, foram reduzidos na vereda vizinha a áreas de cultivo.		[Figueiredo, Cícero Célio de] Universidade de Brasília, Brazil; [Brasil, Eliana Paula Fernandes; Leandro, Wilson Mozena] Universidade Federal de Goiás, Brazil; [Sousa, Ricardo Fernandes de] Instituto Federal de Educação, Ciência e Tecnologia de Goiás, Brazil		leandro, wilson/AAZ-6937-2020	leandro, wilson/0000-0002-3141-1588; FERNANDES BRASIL, ELIANA PAULA/0000-0003-4474-4653		52	2	10	0	20	Sociedade Brasileira de Ciência do Solo	Viçosa	Viçosa	1806-9657	02	2015	39	1	222	231	10.1590/01000683rbcs20150048	Soil Science	SciELO Brazil	Agriculture	SCIELO:S0100-06832015000100222	gold				
