PT	AU	BE	TI	X1	Y1	Z1	SO	LA	DT	DE	X5	Y5	Z5	AB	X4	Y4	Z4	C1	EM	RI	OI	CR	NR	TC	Z9	U1	U2	PU	PI	PA	SN	PD	PY	VL	IS	BP	EP	DI	EC	C2	SC	UT	OA	HC	HP	DA
J	VIEIRA, Darlene Ana de Paula; Caliari, Márcio; SOUZA, Eli Regina Barboza de; SOARES JÚNIOR, Manoel Soares		Mechanical resistance, biometric and physicochemical characteristics of tomato cultivars for industrial processing				Food Science and Technology	English	research-article	Solanum lycopersicum L.; epidermis; fruit size; puncture; peduncle scar				Abstract In order to help the choice and recommendation of cultivars with the greater mechanical resistance of fruits, this research aimed to determine the mechanical resistance and biometric and physicochemical characteristics of tomato cultivars for industrial processing. Eleven processing tomato cultivar fruits cultivar were used (IT761, H9992, H9553, AP533, Advance, N901, BR-Sena, U2006, HY26, HY37 and HY68). Tomatoes firmness was influenced by several factors, including thickness, epidermal cell shape, and internal structures. In general terms, fruits more resistant to compression and puncture presented low longitudinal diameter (55-59 mm), cross-sectional diameter (42-45 mm), scar diameter (5.8-6.6 mm), pericarp thickness (5.9-7.7 mm), fresh weight (56 - 70 g), volume (61-77 cm3) and ash (0.34-0.40 g 100 g-1), and high moisture content (96.2-96.6 g 100 g-1), and pectin content (0.39-0.47 mg 100 g-1). The fruits showing a better mechanical resistance come from AP533, IT761, HY37 and H9992 cultivars, which should be recommended for cultivation in order to reduce losses during harvest, bulk handling and transportation.				[Caliari, Márcio; SOUZA, Eli Regina Barboza de; SOARES JÚNIOR, Manoel Soares] Universidade Federal de Goiás, Brazil; [VIEIRA, Darlene Ana de Paula] Instituto Federal de Goiás, Brasil		de Souza, Eli Regina Barboza/ABI-6727-2020; Júnior, Manoel Soares Soares/ABH-9440-2020; Caliari, Márcio/ABI-1295-2020; Vieira, Darlene/ABC-6498-2020	Júnior, Manoel Soares Soares/0000-0001-8728-4592; Vieira, Darlene/0000-0001-8040-4934; Barboza de Souza, Eli Regina/0000-0001-6225-6122		32	0	2	1	6	Sociedade Brasileira de Ciência e Tecnologia de Alimentos			1678-457X	12	2019	39	suppl 2	363	370	10.1590/fst.32417	Food Science & Technology	SciELO Brazil	Food Science & Technology	SCIELO:S0101-20612019000600363	gold				
J	Maciel, Jhonny W.; Kalinke, Lucas H. G.; Valdo, Ana K.; Martins, Felipe T.; Rabelo, Renato; Moliner, Nicolás; Cano, Joan; Julve, Miguel; Lloret, Francesc; Cangussu, Danielle		New Metal-Organic Systems with a Functionalized Oxamate-Type Ligand and MnII, FeII, CuII and ZnII				Journal of the Brazilian Chemical Society	English	research-article	iron(II); manganese(II); zinc(II); copper(II); oxamate; magnetic properties; single-ion magnet				Four new complexes of formula [Fe(H2pcpa)2(H2O)2] (1), {[Mn(Hpcpa)(H2O)3]•1/2H2O}n (2), {[Zn(Hpcpa)(H2O)3]•1/2H2O}n (3) and [Cu2(Hpcpa)2(bipy)2]•8H2O (4) [H3pcpa = N-(4-carboxyphenyl)oxamic acid; bipy = 2,2¢-bipyridine] have been synthesized and their structures determined by X-ray diffraction. The structure of 1 consists of mononuclear iron(II) units where each iron(II) ion is six-coordinate by two trans-positioned water molecules and two bidentate H2pcpa- ligands building a distorted octahedral environment. 2 and 3 consist of neutral zigzag chains of MnII and ZnII ions respectively, the Hpcpa2- groups acting as linkers in a bidentate/monodentate coordination mode with three mer-positioned water molecules achieving the six-coordination around the metal centers. Compound 4 is a neutral centrosymmetric dicopper(II) complex where two Hpcpa2- groups adopting the bidentate/monodentate coordination mode and act as bridges and bidentate bipy molecules act as end-cap ligands, describing a square pyramidal surrounding around each copper atom. Cryomagnetic measurements for 1, 2 and 4 in the temperature range 1.9-300 K reveal the occurrence of a field-induced single-ion magnet (SIM) behavior (1) and weak interchain (J = -0.22 cm-1, 2) and intradimer (J = -0.39 cm-1, 4) antiferromagnetic interactions, the Hamiltonian being defined as H = -J Sa.Sb.				[Maciel, Jhonny W.; Kalinke, Lucas H. G.; Valdo, Ana K.; Martins, Felipe T.; Cangussu, Danielle] Universidade Federal de Goiás, Brazil; [Rabelo, Renato; Moliner, Nicolás; Julve, Miguel; Lloret, Francesc] Instituto de Ciencia Molecular, Spain; [Kalinke, Lucas H. G.; Cano, Joan] Instituto Federal de Goiás, Brazil		Kalinke, Lucas H G/D-2245-2015; de Oliveira Maciel, Jhonny Willians/ABC-7270-2020; Cano, Joan/A-4684-2012	Kalinke, Lucas H G/0000-0001-7765-1184; de Oliveira Maciel, Jhonny Willians/0000-0003-1706-3756;		93	0	11	0	10	Sociedade Brasileira de Química			1678-4790	11	2019	30	11	2413	2429	10.21577/0103-5053.20190158	Chemistry, Multidisciplinary	SciELO Brazil	Chemistry	SCIELO:S0103-50532019001102413	gold				
J	Carneiro, Fernando Henrique Silva; Pereira, Cláudia Catarino; Teixeira, Marcelo Resende; Húngaro, Edson Marcelo; Mascarenhas, Fernando		Orçamento do esporte no governo Dilma: a primazia dos interesses econômicos e o direito escanteado				Revista Brasileira de Ciências do Esporte	Portuguese	research-article	Public fund; Sport; Financing of sport; Government Dilma	Fondos públicos; Deporte; Financiación del deporte; Gobierno Dilma	Fundo público; Esporte; Financiamento do esporte; Governo Dilma		Abstract Sport has an integrative function, above all, through social sports policies, as well as an economic function of guaranteeing the general conditions of production, which was evidenced in Brazil from the major sporting events. The objective of this research was to identify the configuration of budget spending with sports in the Dilma government. This is a documentary survey based on the Pluriannual Plan - 2012/2015 and budget execution data extracted from the SIGA Brasil Portal, in which the magnitude and direction of expenditure indicators were analyzed. We identified that there are limits to the effectiveness of planned expenditures, as well as the privilege of spending on large events and infrastructure, to the detriment of direct spending on sports.	Resumen El deporte tiene tanto una función integradora, sobre todo, por medio de las políticas sociales deportivas, como la función económica de garantizar las condiciones generales de producción, que se ha puesto de manifiesto en Brasil a partir de la celebración de grandes eventos deportivos. El objetivo de esta investigación fue identificar la configuración del gasto presupuestario en deporte en el gobierno Dilma. Esta es una investigación documental realizada con base en el Plan Plurianual 2012/2015 y datos de la ejecución presupuestaria extraídos del portal SIGA Brasil, en la cual se analizaron los indicadores magnitud y dirección del gasto. Identificamos que hubo límites a la efectividad de los gastos planificados y se privilegió el gasto en grandes eventos e infraestructura en detrimento de los gastos directamente relacionados con la práctica deportiva.	Resumo O esporte tem tanto uma função integradora, sobretudo por meio das políticas sociais esportivas, quanto uma função econômica de garantir as condições gerais de produção, que se evidenciou no Brasil a partir dos grandes eventos esportivos. O objetivo desta pesquisa foi identificar a configuração do gasto orçamentário com esporte no governo Dilma. Esta é uma pesquisa documental feita com base no Plano Plurianual – 2012/2015 e dados da execução orçamentária extraídos do Portal Siga Brasil, em que foram analisados os indicadores magnitude e direção do gasto. Identificamos que há limites à efetivação dos gastos planejados, bem como privilégio do gasto com grandes eventos e infraestrutura em detrimento dos gastos diretos com a prática esportiva.		[Carneiro, Fernando Henrique Silva] Instituto Federal de Goiás, Brasil; [Carneiro, Fernando Henrique Silva; Pereira, Cláudia Catarino; Teixeira, Marcelo Resende; Húngaro, Edson Marcelo; Mascarenhas, Fernando] Universidade de Brasília, Brazil; [Carneiro, Fernando Henrique Silva; Pereira, Cláudia Catarino; Teixeira, Marcelo Resende; Húngaro, Edson Marcelo; Mascarenhas, Fernando] Universidade de Brasília, Brazil; [Teixeira, Marcelo Resende] Ministério do Esporte, Brazil			Hungaro, Edson Marcelo/0000-0002-7230-0155; Carneiro, Fernando Henrique/0000-0002-2800-1895; Mascarenhas, Fernando/0000-0003-0265-502X		19	1	5	0	0	Colégio Brasileiro de Ciências do Esporte			2179-3255	10	2019	41	4	343	349	10.1016/j.rbce.2018.03.032	Sport Sciences	SciELO Brazil	Sport Sciences	SCIELO:S0101-32892019000400343	gold				
J	LIMA, SUZETE FERNANDES; PEREIRA, LEANDRO SPÍNDOLA; SOUSA, GUSTAVO DORNELES DE; OLIVEIRA, GUSTAVO SILVA DE; JAKELAITIS, ADRIANO		SUPPRESSION OF Urochloa brizantha AND U. ruziziensis BY GLYPHOSATE UNDERDOSES	SUPRESSÃO DE Urochloa brizantha e U. ruziziensis POR SUBDOSES DE GLYPHOSATE			Revista Caatinga	English	research-article	Weeds; No-tillage system; Intercropping; Integrated crop-livestock system		Plantas daninhas; Sistema Plantio Direto; Cultivos consorciados; Integração lavoura pecuária		ABSTRACT Intercropping of Urochloa species with corn is an alternative to enable the no-tillage system, besides influencing weed community. Therefore, the investigation of underdoses of the herbicide glyphosate to manage grasses in intercropping systems, avoid grain yield losses, and make feasible intercropping in agricultural areas is important. This study aimed to evaluate glyphosate underdoses in the suppression of Urochloa brizantha cv. Marandu and Urochloa ruziziensis and weed control. Two tests were conducted under field conditions in a randomized block design with four replications and eight treatments consisting of increasing glyphosate doses (0, 54, 108, 270, 378, 540, 756, and 1.080 g a.e. ha−1). All treatments received a dose of 1.200 g a.i. ha−1 of atrazine. Evaluations of phytointoxication of brachiaria plants were carried out at 7, 14, 21, and 28 days after application. Moreover, total dry matter, leaf dry matter, stem dry matter, leaf to stem ratio, and canopy height of brachiaria plants and density and dry matter production of weed community were evaluated at 80 and 125 days after sowing. Glyphosate underdoses lower than 238 and 105 g a.e. ha−1 have potential to be investigated aiming at the management of U. brizantha cv. Marandu and U. ruziziensis, respectively.		RESUMO O consórcio de espécies de Urochloa com milho é uma alternativa para viabilizar o Sistema Plantio Direto, além de influenciar na comunidade de plantas daninhas. Assim torna-se importante pesquisar subdoses do herbicida glyphosate para o manejo da gramínea no consórcio, para evitar perdas de produção de grãos e viabilizar o consórcio em áreas agrícolas. Objetivou-se avaliar subdoses de glyphosate na supressão de Urochloa brizantha cv. Marandu e Urochloa ruziziensis e o controle de plantas daninhas. Dois ensaios foram conduzidos em campo em delineamento experimental de blocos casualizados, com quatro repetições e oito tratamentos, formados por doses crescentes do herbicida glyphosate (0; 54; 108; 270; 378; 540; 756 e 1.080 g de e.a. ha-1). Em todos os tratamentos foram adicionados 1.200 g de i.a. ha-1 de atrazine. Foram realizadas avaliações de fitointoxicação de plantas de braquiária aos 7, 14, 21 e 28 dias após a aplicação. E aos 80 e 125 dias após a semeadura foram realizadas avaliações de produção de massa seca total, massa seca de folha, massa seca de colmos, relação folha:colmo e altura do dossel, além da densidade e produção de massa seca da comunidade de plantas daninhas. Subdoses de glyphosate abaixo de 238 e de 105 g de e.a. ha-1 possui potencial para serem pesquisadas visando o manejo de U. brizantha cv. Marandu e U. ruziziensis, respectivamente.		[LIMA, SUZETE FERNANDES; PEREIRA, LEANDRO SPÍNDOLA; SOUSA, GUSTAVO DORNELES DE; OLIVEIRA, GUSTAVO SILVA DE; JAKELAITIS, ADRIANO] Instituto Federal de Educação, Ciência e Tecnologia de Goiás, Brazil		Jakelaitis, Adriano/L-6042-2016	Jakelaitis, Adriano/0000-0003-0093-9846		30	1	3	0	0	Universidade Federal Rural do Semi-Árido			1983-2125	09	2019	32	3	581	589	10.1590/1983-21252019v32n302rc	Agriculture, Dairy & Animal Science; Agronomy; Fisheries; Food Science & Technology; Forestry; Veterinary Sciences	SciELO Brazil	Agriculture; Fisheries; Food Science & Technology; Forestry; Veterinary Sciences	SCIELO:S1983-21252019000300581	gold				
J	SILVA, GERLANGE SOARES DA; SILVA, JUCICLÉIA SOARES DA; PEREIRA, FRANCISCO ADRIANO DE CARVALHO; SANTANA, RODRIGO ALMEIDA; FIRMO, RAFAEL SILVA; LOPES SOBRINHO, OSWALDO PALMA		SPATIAL VARIABILITY OF THE SATURATED HYDRAULIC CONDUCTIVITY OF SOIL IN COCOA FARMING IN RECÔNCAVO BAIANO	VARIABILIDADE ESPACIAL DA CONDUTIVIDADE HIDRÁULICA SATURADA DO SOLO SOB CULTIVO DE CACAU NO RECÔNCAVO BAIANO			Revista Caatinga	English	research-article	Theobroma cacao L; Precision agriculture; Geostatistics; Soil water physical attributes		Theobroma cacao L; Agricultura de precisão; Geoestatística; Atributos físico-hídricos do solo		ABSTRACT Irrigated cocoa cultivation opened the way for production in Coastal Tablelands soils. However, in this region, the cohesive layer formed near the surface can be a limiting factor for production. The knowledge of physical soil water attributes enables the efficient irrigation management of cohesive soils. This study characterized and modeled the spatial variability of saturated hydraulic conductivity (K0) in a Distrocoeso Oxisoil of the Recôncavo Baiano Coastal Tablelands. The soil sampling was performed as undeformed structures from 50 spaced points in an 8.0 to 8.0 m area, at three different depths in the experimental area of the Federal University of Bahia Recôncavo in the Cruz das Almas-BA cultivated with cocoa (‘CCN 51’). In the laboratory, K0 was determined by permeameter method constant load, and the pore size distribution was determined using the voltage table and the soil density (Ds). Data were analyzed using descriptive statistics and geostatistics. On average, the K0 values were 40.41, 26.49, and 37.82 mm-1 h-1 at the depths from 0.0-0.15 m, 0.15-0.30, and 0.30-0.45 m. The Gaussian model was the best fit to the K0 data set. For soil class, the K0 showed a strong spatial dependence due to their relationship with the physical properties of the soil, its use, and handling. Since an important attribute for the delimitation of homogeneous areas for specific site management purposes as well be considered.		RESUMO O cultivo de cacau irrigado abriu espaço para a produção em solos de Tabuleiros Costeiros. Porém, nesta região, a camada coesa formada próxima da superfície, pode ser um fator limitante para sua produção. O conhecimento dos atributos físico-hídricos do solo possibilitará um manejo eficiente da irrigação em solos coesos. Com isso, objetivou-se caracterizar e modelar a variabilidade espacial da condutividade hidráulica saturada em Latossolo Amarelo Distrocoeso dos Tabuleiros Costeiros do Recôncavo Baiano. A amostragem de solo na estrutura indeformada foi realizada em 50 pontos espaçados de 8,0 em 8,0 m, em três diferentes profundidades na área experimental da Universidade Federal do Recôncavo da Bahia, em Cruz das Almas - BA, cultivada com cacau CCN 51. Determinou-se em laboratório a K0 utilizando permeâmetro de carga constante, distribuição de poros utilizando mesa de tensão e a densidade do solo. Realizou-se análises descritiva e de geoestatística. Em média os valores da K0 foram 40,41 mm h-1, 26,49 mm h-1 e 37,82 mm h-1 nas profundidades 0,0-0,15 m, 0,15-0,30 m e 0,30-0,45 m. O modelo gaussiano foi o que melhor se ajustou ao conjunto de dados da K0. Para a classe de solo avaliada, a K0 apresentou uma forte dependência espacial devido a sua relação com as propriedades físicas do solo, seu uso e manejo. Podendo assim, ser considerado um importante atributo para a delimitação de zonas homogêneas para fins de manejo sítio específicos.		[LOPES SOBRINHO, OSWALDO PALMA] Instituto Federal de Educação, Ciência e Tecnologia de Goiás, Brazil; [SILVA, GERLANGE SOARES DA; PEREIRA, FRANCISCO ADRIANO DE CARVALHO] Universidade Federal do Recôncavo da Bahia, Brazil; [SANTANA, RODRIGO ALMEIDA; FIRMO, RAFAEL SILVA] Universidade Federal do Recôncavo da Bahia, Brazil; [SILVA, JUCICLÉIA SOARES DA] Embrapa Semiárido, Brazil		Sobrinho, Oswaldo Palma Lopes/AAV-7233-2020; OPLS, Oswaldo Palma Lopes Sobrinho/T-5596-2018	Sobrinho, Oswaldo Palma Lopes/0000-0002-4632-695X; OPLS, Oswaldo Palma Lopes Sobrinho/0000-0002-4632-695X; Soares da Silva, Gerlange/0000-0002-0254-2159		31	0	0	0	1	Universidade Federal Rural do Semi-Árido			1983-2125	09	2019	32	3	786	794	10.1590/1983-21252019v32n323rc	Agriculture, Dairy & Animal Science; Agronomy; Fisheries; Food Science & Technology; Forestry; Veterinary Sciences	SciELO Brazil	Agriculture; Fisheries; Food Science & Technology; Forestry; Veterinary Sciences	SCIELO:S1983-21252019000300786	gold				
J	GARCIA, Lismaíra Gonçalves Caixeta; SILVA, Edson Pablo da; SILVA NETO, Carlos de Melo e; VILAS BOAS, Eduardo Valério de Barros; ASQUIERI, Eduardo Ramirez; DAMIANI, Clarissa; SILVA, Flávio Alves da		Effect of the addition of calcium chloride and different storage temperatures on the post-harvest of jabuticaba variety Pingo de Mel				Food Science and Technology	English	research-article	antioxidants; respiration rate; vitamin C; weight loss				Abstract The objective of this study was to analyze the effect of different calcium chloride concentrations on the post-harvest conservation of jabuticaba variety Pingo de Mel at different storage temperatures. The fruit were collected 30 days after the anthesis and subjected to immersions in calcium chloride solution at different concentrations (0%, 2%, 4%, and 6%) for 30 minutes at room temperature. Then, the fruit were dried and packed in polypropylene bags and incubated in a chamber at different temperatures (6 °C, 12 °C, and 25 °C). Samples were analyzed at time 0 and every two days, up to 12 days of storage. No effect of different calcium chloride concentrations was observed in the fruit characteristics at different storage temperatures over time. During storage, an increase of soluble and total pectin contents, antioxidant activity, CO2, total sugars, acidity, and weight loss was observed. Higher storage temperatures affected both the increase in weight loss, pH, and O2 production and the reduction of vitamin C content. Refrigeration was important for the post-harvest conservation of jabuticaba variety Pingo de Mel , once the fruit stored at 6 °C suffered minor variations with improvements or little changes during the 12 days.				[SILVA, Edson Pablo da] Universidade Federal de Lavras, Brazil; [ASQUIERI, Eduardo Ramirez; DAMIANI, Clarissa; SILVA, Flávio Alves da] Universidade Federal de Goiás, Brazil; [VILAS BOAS, Eduardo Valério de Barros] Universidade Federal de Lavras, Brazil; [SILVA NETO, Carlos de Melo e] Instituto Federal de Educação, Ciência e Tecnologia de Goiás, Brazil; [GARCIA, Lismaíra Gonçalves Caixeta] Instituto Federal Goiano, Brazil		Silva-Neto, Carlos M/A-2003-2016; Silva, Flávio/ABA-6664-2020; ASQUIERI, EDUARDO R/P-7700-2018; Damiani, Clarissa/D-5912-2013	Silva-Neto, Carlos M/0000-0001-8624-3836; Damiani, Clarissa/0000-0001-8507-0320; SILVA, FLAVIO/0000-0002-3619-755X; Ramirez Asquieri, Eduardo/0000-0003-3312-8003		38	0	0	0	2	Sociedade Brasileira de Ciência e Tecnologia de Alimentos			1678-457X	06	2019	39	suppl 1	261	269	10.1590/fst.02318	Food Science & Technology	SciELO Brazil	Food Science & Technology	SCIELO:S0101-20612019000500261	gold				
J	Ferreira, Mariana Toledo		Periferia pensada em termos de falta: uma análise do campo da genética humana e médica	Periphery thought in terms of lack: an analysis of the field of human and medical Genetics			Sociologias	Portuguese	research-article	Center-periphery relations; Production and circulation of knowledge; International collaborations; Human and medical genetics; Brazilian science		Relações centro-periferia; Produção e circulação do conhecimento; Colaborações internacionais; Genética humana e médica; Ciência brasileira		Abstract This article seeks to discuss different dimensions of the relation between centers and peripheries in the production and circulation of knowledge, based on a case study of research programs of human and medical genetics in Brazil. Fieldwork included the selection of a sample of researchers in the field of human and medical genetics in Brazil, leading to the identification of graduate programs of “excellence”, located in four public research universities: Universidade de São Paulo - campus Ribeirão Preto; Universidade Estadual de Campinas; Universidade Federal do Pará, and Universidade Federal do Rio Grande do Sul. 46 semi-structured interviews were held with researchers belonging to the institutions hosting these programmes, after which the software Atlas Ti was used to analyse them. Exploring this material allowed to discuss the representations of these researchers about the possibilities and limits to conduct research in a disciplinary context perceived as unequal, compared to the foreign research centers visited in their training and postdoctoral experiences. These representations are summarized in the idea of a relational periphery, articulated in terms of lack, understood in reference to institutional, financial, technical, cultural and cognitive questions.		Resumo Este artigo busca discutir dimensões da relação entre centros e periferias na produção e circulação do conhecimento, a partir de um estudo de caso que se debruça sobre a área da genética humana e médica no Brasil. Para tanto, realizou-se um trabalho de campo que compreendeu a seleção de uma amostra de pesquisadores da área no Brasil, que levou à identificação dos programas de pós-graduação “de excelência”, localizados em quatro universidades públicas: Universidade de São Paulo - campus Ribeirão Preto; Universidade Estadual de Campinas; Universidade Federal do Pará; e Universidade Federal do Rio Grande do Sul. Foram então realizadas 46 entrevistas semiestruturadas com pesquisadores pertencentes a essas instituições, para cuja análise utilizou-se o programa Atlas Ti. A exploração desse material permitiu analisar as representações dos pesquisadores sobre as possibilidades e limites de realizar pesquisa em um contexto disciplinar percebido como desigual, se comparado aos centros de pesquisa estrangeiros visitados em suas experiências de formação e pós-doutorado. Essas representações são expressas na ideia de uma periferia relacional, articulada em termos de falta, entendida em referência a questões institucionais, financeiras, técnicas, culturais e cognitivas.**		[Ferreira, Mariana Toledo] Instituto Federal de Educação, Ciência e Tecnologia de Goiás, Brazil			Toledo Ferreira, Mariana/0000-0001-7517-0379		35	2	3	0	2	Programa de Pós-Graduação em Sociologia - UFRGS			1807-0337	04	2019	21	50	80	115	10.1590/15174522-02105003	Sociology	SciELO Brazil	Sociology	SCIELO:S1517-45222019000100080	gold				
