PT	AU	BE	TI	X1	Y1	Z1	SO	LA	DT	DE	X5	Y5	Z5	AB	X4	Y4	Z4	C1	EM	RI	OI	CR	NR	TC	Z9	U1	U2	PU	PI	PA	SN	PD	PY	VL	IS	BP	EP	DI	EC	C2	SC	UT	OA	HC	HP	DA
J	Campos de Melo, Aniela Pilar; Fernandes, Paulo Marçal; Silva Neto, Carlos de Melo e; Ferreira, Gislene Auxiliadora; Seleguini, Alexsander		First record of Chloridea (Heliothis) subflexa (Lepidoptera: Noctuidae: Heliothinae) on cape gooseberry (Physalis peruviana) in Brazil	Primer registro de Chloridea (Heliothis) subflexa (Lepidoptera: Noctuidae: Heliothinae) en uchuva en Brasil			Revista Colombiana de Ciencias Hortícolas	English	research-article	exotic fruit; subflexus straw moth; organic system	fruta exótica; gusano del tomato de cascara; sistema orgánico			ABSTRACT Chloridea (Heliothis) subflexa (Guenée) (Lepidoptera: Noctuidae: Heliothinae) is a frugivorous and monophagous species with plant hosts in the genus Physalis. In the last few years, the subflexus straw moth became the main pest-insect in tomatillo crops (Physalis ixocarpa Brotero) in Mexico and cape gooseberry (Physalis peruviana L.) crops in Argentina. The objective was to provide the first record of C. subflexa on P. peruviana in Brazil. The specimens were collected in the larval stage and kept on a natural diet until reaching the adult stage. Species identification was carried out based on morphological criteria. Damage from C. subflexa on P. peruviana fruits cultivated in an organic system were recorded. This is the first record in Brazil.	RESUMEN Chloridea (Heliothis) subflexa (Guenée) (Lepidoptera: Noctuidae: Heliothinae) es una especie frugívora y monófoga con hospederos que consta de las plantas del género Physalis. En los últimos años, gusano del tomato de cascara se convirtió en la principal plagas-insectos en cultivos de tomatillo (Physalis ixocarpa Brotero de México) y cultivo de la uchuva (Physalis peruviana L.) en Argentina. El objetivo fue reportar el primer registro de C. subflexa en P. peruviana en Brasil. Los especímenes se recogieron en la fase larvaria y se mantuvieron en una dieta natural hasta llegar a la etapa adulta. La identificación de especies se realizó en base a criterios morfológicos. Se registraron la presencia y daños causados por C. subflexa en frutos de P. peruviana, producidos en un sistema orgánico. Este es el primer registro para Brasil.			[Campos de Melo, Aniela Pilar] Universidade Federal de Goiás, Brazil; [Fernandes, Paulo Marçal; Ferreira, Gislene Auxiliadora] Universidade Federal de Goiás, Brazil; [Seleguini, Alexsander] Universidade Federal do Triângulo Mineiro, Brazil; [Silva Neto, Carlos de Melo e] Instituto Federal de Educação, Ciência e Tecnologia de Goiás, Brazil					35	0	0	0	0	Sociedad Colombiana de Ciencias Hotícolas, Universidad Pedagógica y Tecnológica de Colombia			2011-2173	12	2017	11	2	267	272	10.17584/rcch.2017v11i2.6269	Horticulture	SciELO Colombia	Agriculture	SCIELO:S2011-21732017000200267	gold				
J	Costa, Renata Luiza da; Santos, Júlio César dos		A evasão em cursos técnicos a distância	Dropout in distance technical courses			Educar em Revista	Portuguese	research-article	Dropout; Vocational Course; Distance Education; Distance Technical Course		Evasão; Educação profissional; Educação a Distância; Curso técnico a distância		ABSTRACT This article aims to discuss the results of a research centered on the study of the dropout phenomenon in distance courses, focusing on the reasons related to the educational institution. Based on Heijmans, Fini and Lüscher, Lobo, Vygotsky e Luria, the research was carried out with students of subsequent technical courses offered by a federal institute. We analyzed academic documents and applied an online questionnaire for a group of 39 former students. The results showed that the reasons for evasion related to the institution (38%) have more to do with methodological issues of distance learning and internal and external communication with the community (divulgation and gaps in the notice boards). Around 26% of the students cited frustration with the pedagogical functioning of the course: the online class format, the professor’s performance, the support of the student's activities and the conjugation with face-to-face moments. From this, we could infer that the reasons for avoidance as related to the methodology of distance teaching/learning are centered on a feeling of frustration with the learning process due to insufficient pedagogical accompaniment (lack of online contact with the professor and lack of formation on the tutor’s part). These characteristics trigger feelings of not belonging to the institution and contempt for student learning, leading the beginning of a process of disinterest in the course that culminates in the dropout process.		RESUMO O presente artigo discute os resultados de pesquisa voltada para o estudo da evasão em cursos a distância com foco nos motivos ligados à instituição de ensino. Fundamentados em Heijmans, Fini e Lüscher, Lobo, Vygotsky e Luria, dentre outros referenciais, a pesquisa foi realizada com alunos de cursos técnicos subsequentes a distância de um Instituto Federal. Foram analisados documentos acadêmicos e aplicado questionário semiaberto e online para um grupo de 39 alunos evadidos. Os resultados mostraram que os motivos de evasão ligados à instituição (38%) são mais concentrados em questões metodológicas do curso a distância e em questões de comunicação interna e externa com a comunidade (divulgação e edital com lacunas). Em torno de 26% dos alunos citaram frustração com o funcionamento pedagógico do curso: o formato da aula online, o modo de atuação do professor, o apoio às atividades do aluno e a conjugação com momentos presenciais. A partir disso, pudemos inferir que as razões para evasão ligadas à metodologia de ensino e à aprendizagem a distância estão centradas numa sensação de frustração com a aprendizagem devido ao acompanhamento pedagógico insuficiente (carência de contato com o professor e o tutor não ser da área da disciplina), a qual desencadeia sentimentos de não pertencimento institucional e de desprezo pela aprendizagem do aluno, sendo que este último leva a um processo de gradativo desinteresse pelo curso culminando em evasão.		[Costa, Renata Luiza da] Instituto Federal de Educação, Ciência e Tecnologia de Goiás, Brazil; [Santos, Júlio César dos] Instituto Federal de Educação, Ciência e Tecnologia de Goiás, Brazil					20	0	0	0	3	Setor de Educação da Universidade Federal do Paraná			1984-0411	12	2017		66	241	256	10.1590/0104-4060.50700	Education & Educational Research	SciELO Brazil	Education & Educational Research	SCIELO:S0104-40602017000400241	gold				
J	Machado, Roriz Luciano; Carvalho, Daniel Fonseca de; Rouws, Janaina Ribeiro Costa; Almeida, Wilk Sampaio de; Oliveira, Paulo Tarso Sanches de		Multivariate Analysis of Erosivity Indices and Rainfall Physical Characteristics Associated with Rainfall Patterns in Rio de Janeiro				Revista Brasileira de Ciência do Solo	English	research-article	water erosion; EI30; canonical discriminant analysis				ABSTRACT The identification of areas with greater erosive potential is important for planning soil and water conservation. The objective of this study was to evaluate the physical characteristics of rainfall events in the state of Rio de Janeiro, Brazil, and their interactions with rainfall patterns through multivariate statistical analysis. Rainfall depth, kinetic energy, 30-min intensity (I30), duration of rainfall events, and the erosivity indices KE >10, KE >25, and EI30 in 36 locations (stations) were subjected to principal component analysis (PCA) and canonical discriminant analysis (CDA). Based on evaluation of the respective historical series of hyetographs, it was found that the advanced pattern occurs with highest frequency (51.8 %), followed by the delayed pattern (26.1 %), and by the intermediate pattern (22.1 %). All the evaluated rainfall characteristics have high response capacity in describing localities and rainfall patterns through PCA and CDA. In CDA, the Tukey test (p<0.05) applied to the scores of the first canonical discriminant function (CDF1) allowed differentiation of the stations with respect to the rainfall and erosivity characteristics for the advanced and delayed patterns. In the delayed pattern, the localities of Angra dos Reis, Campos, Eletrobrás, Manuel Duarte, Santa Isabel do Rio Preto, Tanguá, Teresópolis, Vila Mambucaba, and Xerém had the highest CDF1 scores, indicating that they have rainfalls with higher depth, I30, and duration because the standardized canonical coefficient (SCC) and the correlation coefficient (“r”) of these characteristics were positive. The rainfall events in the state of Rio de Janeiro differ from one locality to another in relation to the advanced and delayed rainfall patterns, mainly due to the physical characteristics of rainfall depth, I30, and duration, indicating a higher risk of soil loss and runoff in the localities where rainfall events with the delayed pattern prevail.				[Rouws, Janaina Ribeiro Costa] Empresa Brasileira de Pesquisa Agropecuária, Brasil; [Oliveira, Paulo Tarso Sanches de] Universidade Federal de Mato Grosso do Sul, Brazil; [Carvalho, Daniel Fonseca de] Universidade Federal Rural do Rio de Janeiro, Brazil; [Machado, Roriz Luciano] Instituto Federal de Educação, Ciência e Tecnologia de Goiás, Brazil; [Almeida, Wilk Sampaio de] Instituto Federal de Educação, Ciência e Tecnologia de Rondônia, Brazil		Almeida, Wilk/AAN-7266-2020; Oliveira, Paulo Tarso S/A-4187-2011; de Carvalho, Daniel Fonseca/AAQ-1876-2020	Oliveira, Paulo Tarso S/0000-0003-2806-0083; de Carvalho, Daniel Fonseca/0000-0001-7629-9465; Sampaio de Almeida, Wilk/0000-0001-5872-9484		43	0	1	0	3	Sociedade Brasileira de Ciência do Solo			1806-9657	12	2017	41	0	e0160378		10.1590/18069657rbcs20160378	Soil Science	SciELO Brazil	Agriculture	SCIELO:S0100-06832017000100535	gold				
J	Witeze Junior, Geraldo		Como inspirado del espíritu santo: Vasco de Quiroga, primeiro intérprete americano da utopia	Como inspirado del Espíritu Santo: Vasco de Quiroga, primer intérprete americano de la Utopía	Como inspirado del Espíritu Santo: Vasco de Quiroga, first American interpreter of Utopia		Estudos Históricos (Rio de Janeiro)	Portuguese	research-article	utopia; America; colonization; Vasco de Quiroga (1478?-1565)	utopía; América; colonización; Vasco de Quiroga (1478?-1565)	utopia; América; colonização; Vasco de Quiroga (1478?-1565)		Abstract This paper presents the interpretation of Thomas More's Utopia written by Vasco de Quiroga in his treatise entitled Información en derecho (1535). Quiroga fought against slavery and proposed the creation of villages inspired by More's work as a solution to the problems of Spanish colonization in America. His objectives were to guarantee a dignified life for the natives and to evangelize them without using force, from the good example. The methods used come from literary criticism, especially philology, as well as textual exegesis. Utopia is understood as a concrete social-political project and not as mere literature or social criticism.	Resumen Este artículo presenta la interpretación de la Utopía de Tomás Moro hecha por Vasco de Quiroga en su tratado intitulado Información en derecho (1535). Quiroga luchó contra la esclavitud y propuso la creación de pueblos inspirados en la obra de Moro como solución a los problemas de la colonización española en América. Sus objetivos eran garantizar una vida digna para los indígenas y evangelizarlos sin uso de fuerza, a partir del buen ejemplo. Los métodos empleados proceden de la crítica literaria, especialmente la filología, así como la exégesis textual. La utopía es entendida como proyecto político-social concreto y no como mera literatura o crítica social.	Resumo Este artigo apresenta a interpretação da Utopia de Thomas Morus feita por Vasco de Quiroga em seu tratado intitulado Información en derecho (1535). Quiroga lutou contra a escravidão e propôs a criação de povoados inspirados na obra de Morus como solução para os problemas da colonização espanhola na América. Seus objetivos eram garantir uma vida digna para os indígenas e evangelizá-los sem uso de força, a partir do bom exemplo. Os métodos empregados são oriundos da crítica literária, especialmente a filologia, bem como da exegese textual. A utopia é entendida como projeto político-social concreto e não como mera literatura ou crítica social.		[Witeze Junior, Geraldo] Instituto Federal de Educação, Ciência e Tecnologia de Goiás, Brazil					33	0	0	0	0	Centro de Pesquisa e Documentação de História Contemporânea do Brasil da Fundação Getúlio Vargas			2178-1494	12	2017	30	62	535	554	10.1590/s2178-14942017000300002	History; Humanities, Multidisciplinary	SciELO Brazil	History; Arts & Humanities - Other Topics	SCIELO:S0103-21862017000300535	gold				
J	Calil Júnior, Marcos A.; Melo, Átila A. C.; Rodrigues, Emille M.; Sigoli, Fernando A.; Rodrigues, Marcelo O.		The Effect of Hydrothermal Treatment on the Morphologies and Optical Properties of Upconversion NaYF 4:Ln 3+ Crystals				Journal of the Brazilian Chemical Society	English	research-article	upconversion; lanthanides; luminescence; NaYF4 crystals				This work deals with the synthesis and characterization of upconversion NaYF4:Ln3+ crystals. Co-precipitation and hydrothermal methods were used to synthesize NaYF4:Ln3+ crystals. The experimental procedures were modified to obtain crystals in the cubic (α) phase, hexagonal (β) phase or a mixture between cubic and hexagonal (α/β) phases. Reaction temperature was maintained at 200 °C and the time of hydrothermal treatments were maintained at 24 and 48 h. The average diameter of the crystals ranged from 25 nm to 6.4 µm, depending on the chosen synthetic route. These materials can be applied in areas such as photodynamic therapy and bioimaging.				[Calil Júnior, Marcos A.; Melo, Átila A. C.; Rodrigues, Marcelo O.] Universidade de Brasília, Brazil; [Calil Júnior, Marcos A.] Instituto Federal de Educação, Ciência e Tecnologia de Goiás, Brazil; [Rodrigues, Emille M.; Sigoli, Fernando A.] Universidade Estadual de Campinas, Brazil		Rodrigues, Marcelo Oliveira O/J-6367-2014; Sigoli, Fernando A/C-5225-2012; Junior, Marcos Antonio Calil/AAG-5276-2019; Sigoli, Fernando A/AAA-6744-2019	Rodrigues, Marcelo Oliveira O/0000-0003-0684-3618; Sigoli, Fernando A/0000-0003-1285-6765; Martinazzo Rodrigues, Emille/0000-0002-6948-1207		23	0	2	1	27	Sociedade Brasileira de Química			1678-4790	09	2017	28	9	1816	1821	10.21577/0103-5053.20170068	Chemistry, Multidisciplinary	SciELO Brazil	Chemistry	SCIELO:S0103-50532017000901816	gold				
J	SOUZA, Rita Rodrigues de		Modelo de estrutura retórica para leitura e escrita de resumo escolar no ensino médio técnico	Rhetorical model to reading and writing pedagogical abstracts on technical school			DELTA: Documentação de Estudos em Lingüística Teórica e Aplicada	Portuguese	research-article	School summary; Socio-rhetoric; Thetoric structure; Technical education		Resumo escolar; Sociorretórica; Estrutura retórica; Ensino Médio técnico		ABSTRACT This paper presents a rhetorical model for writing summaries at high school technical level. The sociorhetorical genre basis that underlies the proposal is described. From this basis, the moves for writing these summaries about newspapers reports are detailed. Students ´texts written based on this model are analyzed. Results indicate that, by using this proposal, students were able to write a text that is similar to the genre.		RESUMO Este artigo visa a apresentar a descrição de um modelo de estrutura retórica para leitura e escrita de resumo escolar no contexto do ensino médio técnico integrado. Inicialmente, o artigo traz a concepção sócio-retórica de gênero que fundamenta a proposição do modelo. A partir dessa fundamentação, o descreve detalhando os movimentos para escrita de um resumo escolar de reportagem. Em seguida, apresenta uma análise de textos conforme o modelo proposto. Os resultados indicam que, a partir da aplicação da estrutura retórica sugerida, os discentes escreveram um texto mais próximo ao gênero resumo escolar.		[SOUZA, Rita Rodrigues de] Instituto Federal de Goiás, Brazil					25	0	1	0	1	Pontifícia Universidade Católica de São Paulo - PUC-SP			1678-460X	09	2017	33	3	911	943	10.1590/0102-445046525302137346	Linguistics	SciELO Brazil	Linguistics	SCIELO:S0102-44502017000300911	gold				
J	Campos de Melo, Aniela Pilar; Marçal Fernandes, Paulo; e Silva-Neto, Carlos de Melo; Seleguini, Alexsander		Solanáceas em sistema orgânico no Brasil: tomate, batata e physalis	Solanaceas in organic system in Brazil: tomato, potato and cape gooseberry			Scientia Agropecuaria	Portuguese	research-article	Solanum lycopersicum L; Solanum tuberosum L; cape gooseberry; agroecology; alternative systems		Solanum lycopersicum L; Solanum tuberosum L; uchuva; agroecologia; sistemas alternativos		The brazilian scientific research geared towards organic systems still have been permeated by a logic based on the mere substitution of inputs. Lack a deepening in relation to recognition of components of production systems (ecophysiology; management and fertility of the soil; soil and water conservation; health management) and how these can be investigated holistically. Based on such gaps is discussed in this review article the main particularities related to organic production of tomatoes and potatoes, main oleráceas of the nightshade family, Solanaceae, and an exotic fruit potential for organic systems, the physalis (Physalis peruviana L.)		A pesquisa científica brasileira voltada para sistemas orgânicos ainda tem sido permeada por uma lógica baseada na mera substituição de insumos. Falta um aprofundamento em relação ao reconhecimento dos componentes dos sistemas de produção (ecofisiologia; manejo e fertilidade do solo; conservação de água e solo; manejo fitossanitário) e como estes podem ser investigados de forma holística. Baseado em tais lacunas discute-se neste artigo de revisão as principais particularidades relacionadas a produção orgânica de tomate e batata, principais oleráceas da família Solanaceae, e de uma frutífera exótica potencial para sistemas orgânicos, a physalis (Physalis peruviana L.)		[Seleguini, Alexsander] Universidade Federal do Triângulo Mineiro, Brazil; [Campos de Melo, Aniela Pilar; Marçal Fernandes, Paulo] Universidade Federal de Goiás, Brazil; [e Silva-Neto, Carlos de Melo] Instituto Federal de Goiás, Brazil					81	1	1	0	1	Universidad Nacional de Trujillo. Facultad de Ciencias Agropecuarias			2077-9917	07	2017	8	3	279	290	10.17268/sci.agropecu.2017.03.11	Agriculture, Multidisciplinary; Agronomy	SciELO Peru	Agriculture	SCIELO:S2077-99172017000300011	gold				
J	Rios, Leonardo Essado		ABC das Teorias de Mudança de Comportamento: Resenha crítica	ABC of Behaviour Theories: Critical review			Revista Brasileira de Educação Médica	Portuguese	review-article	Behaviour; Behavioural Sciences; Medical Education		Comportamento; Ciências do Comportamento; Educação Médica		ABSTRACT This is a critic review – focusing on medical education – on the work of Michie et al., entitled “ABC of Behaviour Change Theories: an essential resource for researchers, policy makers and practitioners” published in the UK by Silverback Publishing in 2014.		RESUMO Trata-se de resenha crítica – com foco para a educação médica – da obra de Michie et al., intitulada “ABC of Behaviour Change Theories: an essential resource for researchers, policy makers and practitioners”, publicada no Reino Unido pela Silverback Publishing no ano de 2014.		[Rios, Leonardo Essado] Instituto Federal de Educação, Ciência e Tecnologia de Goiás, Brazil		Rios, Leonardo Essado/AAV-4914-2021	Rios, Leonardo Essado/0000-0002-3096-9141		10	2	3	0	1	Associação Brasileira de Educação Médica			1981-5271	06	2017	41	2	356	358	10.1590/1981-52712015v41n2rb20160085	Health Care Sciences & Services	SciELO Brazil	Health Care Sciences & Services	SCIELO:S0100-55022017000200356	gold				
J	Safadi, Sandro de Oliveira		Ocupação urbana, redes sociais e territorialização da resistência: o caso de Aparecida de Goiânia, Brasil	Urban occupation, social medias and the resistance territorialization: the case of Aparecida de Goiânia, Brazil			urbe. Revista Brasileira de Gestão Urbana	Portuguese	research-article	Urban culture; Digital social medias; Territorialization of resistance		Cultura urbana; Redes sociais digitais; Territorialização da resistência		Abstract The analyses here proposed are based on the assumption of the city as the fundamental locus of contemporary tensions. The investigational itinerary tried to explain how the urban culture, considered the central move that daily takes place within the city, establishes with the landscape a relation of resistance against the global dynamics that penetrates places. The object of our study is Aparecida de Goiânia, a city comprised in the metropolitan region of Goiânia-GO. This study has leaned over the cultural materialities perceived in the landscape of Aparecida de Goiânia, intertwining theoretical approaches and contents gathered through interviews and questionnaires carried out with social actors directly involved in non-official culture. Between March 2013 and June 2015, more than three hundred groups/artists were identified, and about eighty institutions and seventy venues that systematically stimulate cultural life in the municipality of Aparecida de Goiânia. We have also added to the empirical research, one hundred and twenty one groups and artists who have profiles in digital social medias. The analysis, in this case, also permeates how digital social medias foster mechanisms of strengthening the cultural dynamics in the process of the lascape's materialities configuration. This materiality, objects, absorb the flows of local rationalities produced by individuals and organized groups, that the participation in these digital social medias encourage belonging, building territorialities resistant in the city.		Resumo É assumindo a cidade como o lócus fundamental das tensões contemporâneas que as análises aqui presentes se sustentam. O itinerário investigativo buscou explicitar como a cultura urbana, entendida como movimento cotidiano central das cidades, estabelece com a paisagem uma relação de resistência à dinâmica global que penetra os lugares. O objeto de estudo em questão é Aparecida de Goiânia, cidade partícipe da Região Metropolitana de Goiânia, no Estado de Goiás. O estudo se debruçou sobre as materialidades culturais que são percebidas na paisagem de Aparecida de Goiânia, entrelaçando apontamentos teóricos e conteúdos obtidos por meio de entrevistas e questionários realizados com atores sociais diretamente envolvidos com a cultura não oficializada. Entre março de 2013 e julho de 2015, identificaram-se mais de 300 grupos/artistas e cerca de 80 entidades e 70 locais que dinamizam sistematicamente a cultura no município de Aparecida de Goiânia. Agregaram-se ainda à pesquisa empírica 121 grupos e artistas que possuem perfis em redes sociais digitais, extraídos do universo identificado. A análise, portanto, permeia também o modo como essas redes fomentam mecanismos de fortalecimento da dinâmica cultural no processo de configuração das materialidades presentes na paisagem. Essas materialidades/objetos absorvem os fluxos de racionalidades locais produzidos pelos indivíduos e pelos grupos organizados; assim, com a participação nas referidas redes sociais digitais, estimula-se o pertencimento e fundam-se territorialidades resistentes na cidade.		[Safadi, Sandro de Oliveira] Instituto Federal de Goiás, Brasil					27	0	0	1	6	Pontifícia Universidade Católica do Paraná			2175-3369	04	2017	9	1	52	67	10.1590/2175-3369.009.001.ao05	Urban Studies	SciELO Brazil	Urban Studies	SCIELO:S2175-33692017000100052	gold				
